track_id,name,Lyric ID,Lyrics
4flkQH0IWDHtwgKNK5asp8,Money Becomes King,403503,"If you reach back in your memory  A little bell might ring  About a time that once existed  When money wasn't king  If you stretch your imagination  I'll tell you all a tale  About a time when everything  Wasn't up for sale  There was this cat named Johnny  Who loved to play and sing  When money wasn't king  We'd all get so excited  When John would give a show  We'd raise the cash between us  And down the road we'd go  To hear him play that music  It spoke right to my soul  Every verse a diamond  And every chorus gold  The sound was my salvation  It was only everything  Before money became king  Well I ain't sure how it happened  And I don't know exactly when  But everything got bigger  And the rules began to bend  And the tv taught the people  How to get their hair to shine  And how sweet life can be  If you keep a tight behind  And they raised the cost of living  And how could we have known  They'd double the price of tickets  To go see Johnny's show?  So we hocked all our possessions  And we sold a little dope  And went off to rock 'n' roll  We arrived there early  In time to see rehearsal  And John came out and lip-synched  His new lite-beer commercial  And as the crowd arrived  As far as I could see  The faces were all different  There was no one there like me  They sat in golden circles  And waiters served them wine  And talked through all the music  And to John paid little mind  And way up in the nosebleeds  We watched upon the screen  They hung between the billboards  So cheaper seats could see  Johnny, rock that golden circle  And all those VIP's  And that music that had freed us  Became a tired routine  And I saw his face in close-up  Trying to give it all he had  And sometimes his eyes betrayed him  You could see that he was sad  And I tried to rock on with him  But i slowly became bored  Could that man on stage with everything  Somehow need some more?  There was no use in pretending  No magic left to hear  All the music gave me  Was a craving for lite-beer  As I walked out of the arena  My ears began to ring  And money became king"
0zG6crJiKpE4IIxSOtZXZs,Dreamville,403507,"Going down to Lillian's music store  To buy a black diamond string  Gonna wind it up on my guitar  Gonna make that silver sing  Like it was Dreamville  A long time ago  A million miles away  All the trees were green  In Dreamville  I keep waking up all by myself  With a Bluejay in my brain  Flapping his wings, making me sing  It was just about to rain  Like it was Dreamville  Where I was born  Light years from here  And the air smelled good  In Dreamville  In Dreamville  Riding with my mamma  To glen springs pool  The water was cold  My lips were blue  There was rock and roll  Across the dial  When I think of her  It makes me smile  Like it was Dreamville  A long time ago  A million miles away  All the trees were green  In Dreamville, in Dreamville  Yeah it was Dreamville  A long time ago  Light years from here  And the air smelled good  In Dreamville, in Dreamville"
37rAZwJ8r3lOzXPIwNujh3,Joe,403508,"My name's Joe, I'm the CEO  Yeah I'm the man makes the big wheels roll  I'm the hand on the green-light switch  You get to be famous, i get to be rich  Go get me a kid with a good looking face  Bring me a kid can remember his place  Some hungry poet son-of-a-bitch  He gets to be famous, I get to be rich  Or bring me a girl  They're always the best  You put 'em on stage and you have them undress  Some angel whore who can learn a guitar lick  Hey! Now that's what I call music!  Well they'll come looking for money when the public gets bored  But we'll fight them with lawyers they could never afford  Yeah I'll make her look like a spoiled little bitch  She gets to be famous, I get to be rich    So burned out Johnny thinks the books are shifty  What good's that alky to me when he's fifty?  Well we could move catalog if he'd only die quicker  Send my regards to the gig and a case of good liquor  He gets to be famous, I get to be rich  He gets to be famous, I get to be rich  My name's Joe, I'm the CEO  I'm the man makes the big wheels role"
3fSVMOj2BXP3nexp80BHyR,When A Kid Goes Bad,403517,"You got a different kinda look in your eye  Something about you that i don't recognize  These things are talked about in quiet tones  I never saw a person so all alone  Some mama's crying  Some daddy's sad  When a kid goes bad  Makes you wonder  What made him mad  When a kid goes bad  When a kid goes bad  You built for innocence, you built for joy  Suddenly evil's all that you enjoy  But if you shoot at everyone you see  Well, you can't be my friend 'cause you might shoot at me    Somewhere along the way did we let you down?  Did you cry out for help and none was around?  Don't try to tell me that you don't know the score  Are you so shut down you can't feel anymore?  "
6gbUs1Yx5VZVUx2norDa9U,Like A Diamond,403519,"Madmen crawl  Across the wall  Knight gets away  Kings all fall  And queens chase men  And saints all sin  And good things  All must end  But she goes on forever  She goes on forever  Yeah, she's gonna shine forever  Like a diamond  In the sunlight  Big full moon  Above the road  I'm a long long way  From tomorrow  Gotta light my way  Down this highway  To get to her  Because she goes on forever  She goes on forever  Yeah, she's gonna shine forever  Like a diamond  In the sunlight  Deacons steal  And ma can't feel  If you're lonely  And behind the wheel  When the ground gives way  You have to pray  To the unknown  And hope it's real  But she goes on forever  She goes on forever  She's gonna shine forever  She goes on forever  She goes on forever  Yeah, she's gonna shine forever  Like a diamond  In the sunlight"
6xX294DtSXPPsthVYESGmC,Lost Children,403522,Lord please watch over  All these lost children  Born to chase the hurricane  Please shines some light down  On those who wander  Filled with hunger and pain  Please raise the wind for  All those out sailing  On an ocean alone  Lord shine a light on  All these lost children  Far away from their home  Lord keep an eye on  All these lost children  Swept away in the wind  Please shine some light down  On all those traveling  Lead them all home again
0lycDxGsAabqB47w1Wib7t,Blue Sunday,403524,"She took a rolled up twenty  Out of her pocket  And paid for my cigarettes  We were friends at first sight  In the 7-11 light  She said, ""Here, lemme cover it""  And I rode shotgun all that night  She drove, and never made a sound  I asked if there was anything wrong  She said, ""Nothing worth talking 'bout""  It's a blue Sunday  Down the interstate  Yeah a blue Sunday  Blue, with shades of grey  Her backseat could've been a hotel  I slept for a thousand years  Every now and then she'd laugh out loud for no reason  I pretended not to hear  And rolled my jacket up under my head  And stretched my body out  Couldn't be too far in front of her daddy's blood hounds  But i ain't gonna worry now    A blue Sunday  We never met before  It's a blue Sunday  When it's time to leave you go"
1q6KLpnyB8NMcSBUPVTlwa,You And Me,403527,Take a look  At what I got  I can't promise  You a lot  But you and me  And the road ahead  I can't change  You from yourself  You gotta want it  All that's left  Is you and me  And the road ahead  Wherever that wind might blow  Wherever that river rolls  You know I will go with you  Looking over  The mountain's crown  The water roars  And tumbles down  Like you and me  And the road ahead  Wherever that wind might blow  Wherever that river rolls  You know I will go with you  Just you and me  And the road ahead  And the road ahead
7EOhgqeDauipBscd6ElO0I,The Man Who Loves Women,403530,"He's the man who loves women  Women, women, women  He's the man who loves women  And falling in love everyday  When he sees a senorita  It's a sure thing that he'll heed her  He's the man who loves women  And falling in love everyday  But in the morning when she wakes up  He'll be far away  Keeping his secrets safe  Hey hey hey hey  But in the morning when she wakes up  He'll be far away  Keeping his secrets safe  Hey hey hey hey  Ah ah ah  Babe, babe, babe, babe, babe, babe, i love you  He's quite prepared to mingle  Comes on like he's single  He's the man who loves women  And falling in love's just his way  And one of these days he's going to pay  For falling in love everyday  Oh stay away, he's the man who loves women "
6712My4wA0OcvobBeTJttw,"Have Love, Will Travel",403533,"You never had a chance, did you baby  So good looking, so insecure  And now you say you can't remember  When the lines you drew began to blur  Yeah, when all of this is over  Should I lose you in the smoke  I want you to know you were the one  And may my love travel with you everywhere  Yeah, may my love travel with you always  Maggie's still trying to rope a tornado  Joe's in the back yard trying to keep things simple  And the lonely DJ's digging a ditch  Trying to keep the flames from the temple  Oh, and if perhaps I lose you  In the smoke down the road  I want you to know you were the one    How about a cheer for all those bad girls  And all the boys that play that rock and roll  They love it like you love Jesus  It does the same thing to their souls  And when all of this is over  Should I lose you in the smoke  I want you to know that it's all right  And may my love travel with you everywhere  Yeah, may my love travel with you always"
5EUzA8l4fQGvPUkPs8w1X6,Can't Stop The Sun,403534,Well you may take my money  You may turn off my microphone  But you can't steal  What you can't feel  Can't stop the sun from shining  Shining down and down and down  And you may think you control things  But there will be more just like me  Who won't give in  Who'll rise again  Can't stop the world from turning  Turning round and round and round  Hey mister business man  Be sure to wash your hands  Be careful where you stand  Because life goes on and on and on  Life goes on and on and on  And you may think it's all over  But there will be more just like me  Who won't give in  Who'll rise again  Can't stop a man from dreaming  Dreaming on and on and on
1vQxicuNSODoBECPMFjHMG,Handle With Care,144521,"Been beat up and battered around  Been sent up  ,  and I've been shot down  You're the best thing that I've ever found  Handle me with care  Reputation's changeable  Situation's tolerable  But baby, you're adorable  Handle me with care    I'm so tired of being lonely  I still have some love to give  Won't you show me that you really care?    Everybody's got somebody to lean on  Put your body next to mine, and dream on  I've been fobbed off, and I've been fooled  I've been robbed and ridiculed  In day care centres and night schools  Handle me with care  Been stuck in airports, terrorized  Sent to meetings, hypnotized  Overexposed, commercialized  Handle me with care      I've been uptight and made a mess  But I'll clean it up myself, I guess  Oh, the sweet smell of success  Handle me with care"
54TUMbmJFfebiiVR7BJ8XQ,Dirty World,964069,"He loves your sexy body, he loves your dirty mind  He loves when you hold him, grab him from behind  Oh baby, you're such a pretty thing  I can't wait to introduce you to the other members of my gang  You don't need no wax job, you're smooth enough for me  If you need your oil changed, I'll do it for you free  Oh baby, the pleasure would be all mine  If you let me drive your pickup truck and park it where the sun don't shine  Every time he touches you, his hair stands up on end  His legs begin to quiver and his mind begins to bend  Oh baby, you're such a tasty treat  But I'm under doctor's orders, I'm afraid to overeat  He love your sense of humor, disposition too  There's absolutely nothing that he don't love about you  Oh baby, I'm on my hands and knees  Life would be so simple if I only had you to please  Oh baby, turn around and say goodbye  You go to the airport now and I'm going home and cry   electric dumplings   red bell peppers   fuel injection   service charge   five-speed gearbox   long endurance   quest for junk food   big refrigerator   trembling wilbury   marble earrings   porky curtains   power steering   bottled water   parts and service  Dirty world, a dirty world, it's a fucking dirty world"
43AndBfy1f4wGRbHQ9aMpU,Rattled,1640946,"Oh yeah, well  I get rattled every time we meet  I get rattled even in my sleep  I get rattled, baby, oh, over you  Yeah  I get twisted, I get turned around  I get twisted and I'm up and I'm down  I get twisted, baby, oh, over you  Well, baby, baby, baby, won't you save one night for me?  Baby, baby, baby, is there something wrong with you?  Baby, baby, baby, this is out of my control  It looks like nothing's wrong but deep down in my soul  I'm twisted, shaken, rattled  I get rattled, baby, oh, over you  Rattled baby, over you  Oh, baby, baby, baby, won't you save one night for me?  Baby, baby, baby, is there something wrong with you?  Oh, baby, baby, baby, this is out of my control  It looks like nothing's wrong but deep down in my soul  I'm rattled, twisted, shaken  I get twisted, baby, oh, over you  Whoa, I get shaken, I get torn up by the roots  Yeah, I'm shakin' way down in my boots  I get rattled, baby, oh, over you  Yeah, I get rattled, baby, oh, over you  Yeah I'm rattled, baby, over you"
6hOCmsiGjQaS27iiLe2t0i,Last Night,2308950,"  She was there at the bar, she heard my guitar  She was long and tall, she was the queen of them all    Last night, thinking about last night  Last night, thinking about last night    She was dark and discreet, she was light on her feet  We went up to her room and she lowered the boom    Last night, thinking about last night  Last night, thinking about last night    Down below they danced and sang in the street  While up above the walls were steaming with heat    Last night, thinking about last night  Last night, thinking about last night    I was feeling no pain, feeling good in my brain  I looked in her eyes, they were full of surprise    Last night, talking about last night  Last night, talking about last night    I asked her to marry me she smiled and pulled out a knife  The party's just beginning she said, ""Your money or you life?""    Last night, talking about last night  Last night, talking about last night    Now I'm back at the bar, she went a little too far  She done me wrong, all I got is this song    Last night, thinking about last night  Last night, thinking about last night  Last night, talking about last night  Last night, talking about last night  Last night, thinking about last night  Last night..."
4TKjQ87mCaNhuhxhgu4U3h,Not Alone Any More,480657,"You always said that I'd be back again  That I'd come running to you in the end  I thought that you were on your own  And now I find you're not alone   I'll see you through the rain   Through the heartache and pain   It hurts like never before  You're not alone anymore  You always said that I would know someday  Just how it feels when your love walks away  I let you down, I let you go  I lost you how was I to know?   I'll see you through the rain   Through the heartache and pain   It hurts like never before  You're not alone anymore  I never knew I could feel this way  I never could see past yesterday  You feel that everything is gone  I feel it too, you're not alone   I'll see you through the rain   Every heartache and pain   It hurts like never before  You're not alone, you're not alone  You're not alone anymore  Anymore  Anymore"
6yUsNxDvZsPM70eP3bGvOK,Congratulations,961781,"Congratulations for breaking my heart  Congratulations for tearing it all apart  Congratulations, you finally did succeed  Congratulations for leaving me in need  This morning I looked out my window and found  A bluebird singing but there was no one around  At night I lay alone in my bed  With an image of you goin' around in my head  Congratulations for bringing me down  Congratulations, now I'm sorrow bound  Congratulations, you got a good deal  Congratulations, how good you must feel  I guess I must have loved you more than I ever knew  My world is empty now 'cause it don't have you  And if I had just one more chance to win your heart again  I would do things differently, but what's the use to pretend?  Congratulations for making me wait  Congratulations, now it's too late  Congratulations, you came out on top  Congratulations, you never did know when to stop  Congratulations  Congratulations  Congratulations  Congratulations"
3WukTEV57eYvJUfQUCKAMV,Heading For The Light,1786090,"    I've wandered around with nothing more than time on my hands  I was lost in the night with no sight of you  And at times it was so blue and lonely  Heading for the light  Been close to the edge, hanging by my fingernails  I've rolled and I've tumbled through the roses and the thorns  And I couldn't see the sign that warned me  I'm heading for the light    Ooh - I didn't see that big black cloud hanging over me  And when the rain came down I was nearly drowned  I didn't know the mess I was in    My shoes are wearing out from walking down this same highway  I don't see nothing new but I feel a lot of change  And I get the strangest feeling  As I'm heading for the light      Ooh - my hands were tired  Jokers and fools on either side  But still I kept on till the worst had gone  Now I see the hole I was in    My shoes are wearing out from walking down this same highway  I don't see nothing new but I feel a lot of change  And I get the strangest feeling  As I'm heading for the light  I see the sun ahead, I ain't never looking back  All the dreams are coming true as I think of you  Now there's nothing in the way to stop me  Heading for the light    Now there's nothing in the way to stop me  Heading for the light    Woah oh oh  Woah oh oh  Woah oh oh  Heading for the light"
1eFSWURRT65A348FCRh3qo,Margarita,1774517,"Margarita  Ah, ah, ah, ah  Margarita  Ah, ah, ah, ah  It was in Pittsburgh, late one night  I lost my head, got into a fight  I rolled and tumbled till I saw the light  Went to the Big Apple, took a bite  Ah, ah, ah, ah  Still the sun went down your way  Down from the blue into the gray  Where I stood, I saw you walk away   You danced away  Ah, ah, ah, ah  I asked her what we're gonna do tonight  She said, ""Cahuenga Langa-Langa Shoe Box Soup""  We better keep tryin' till we get it right  Tala mala sheela jaipur dhoop  She wrote a long letter on a short piece of paper  Oh Margarita"
2rm4CNyzlEGs3PcK91wzGe,Tweeter And The Monkey Man,348612,"Tweeter and the Monkey Man were hard up for cash  They stayed up all night selling cocaine and hash  To an undercover cop who had a sister named Jan  For reasons unexplained she loved the Monkey Man  Tweeter was a boy scout before she went to Vietnam  And found out the hard way nobody gives a damn  They knew that they found freedom just across the Jersey Line  So they hopped into a stolen car, took Highway 99    And the walls came down, all the way to hell  Never saw them when they're standing, never saw them when they fell  The undercover cop never liked the Monkey Man  Even back in childhood he wanted to see him in the can  Jan got married at fourteen to a racketeer named Bill  She made secret calls to the Monkey Man from a mansion on the hill  It was out on Thunder Road, Tweeter at the wheel  They crashed into paradise, they could hear them tires squeal  The undercover cop pulled up and said ""Everyone of you's a liar  If you don't surrender now, it's gonna go down to the wire""    An ambulance rolled up, a state trooper close behind  Tweeter took his gun away and messed up his mind  The undercover cop was left tied up to a tree  Near the souvenir stand  by the old abandoned factory  Next day the undercover cop was hot in pursuit  He was taking the whole thing personal, he didn't care about the loot  Jan had told him many times it was you to me who taught  In Jersey anything's legal as long as you don't get caught    Someplace by Rahway Prison they ran out of gas  The undercover cop had cornered them said ""Boy, you didn't think that this could last""  Jan jumped out of the bed, said ""There's someplace I gotta go""  She took a gun out of the drawer and said ""It's best if you don't know""  The undercover cop was found face down in a field  The monkey man was on  the river bridge  using Tweeter as a shield  Jan said to the Monkey Man, ""I'm not fooled by Tweeter's curl  I knew him long before he ever became  a Jersey girl  ""    Now the town of Jersey City is quieting down again  I'm sitting in a gambling club called A Lion's Den  The TV set been blown up, every bit of it is gone  Ever since the nightly news show that the Monkey Man was on  I guess I'll go to Florida and get myself some sun  There ain't no more opportunity here, everything's been done  Sometimes I think of Tweeter, sometime I think of Jan  Sometimes I don't think about nothing but the Monkey Man  "
4HA2jo7wkMdN1lmLO6ryzE,End Of The Line,189270,"  Well it's all right, riding around in the breeze  Well it's all right, if you live the life you please  Well it's all right, doing the best you can  Well it's all right, as long as you lend a hand    You can sit around and wait for the phone to ring  Waiting for someone to tell you everything  Sit around and wonder what tomorrow will bring  Maybe a diamond ring    Well it's all right, even if they say you're wrong  Well it's all right, sometimes you gotta be strong  Well it's all right, as long as you got somewhere to lay  Well it's all right, everyday is Judgement Day    Maybe somewhere down the road away  You'll think of me, and wonder where I am these days  Maybe somewhere down the road when somebody plays  Purple haze    Well it's all right, even when push comes to shove  Well it's all right, if you got someone to love  Well it's all right, everything'll work out fine  Well it's all right, we're going to the end of the line    Don't have to be ashamed of the car I drive  I'm just glad to be here, happy to be alive  It don't matter if you're by my side  I'm satisfied    Well it's all right, even if you're old and grey  Well it's all right, you still got something to say    Well it's all right, remember to live and let live  Well it's all right, the best you can do is forgive  Well it's all right, riding around in the breeze  Well it's all right, if you live the life you please    Well it's all right, even if the sun don't shine  Well it's all right, we're going to the end of the line"
74i07fyJWNPDR5q56Wi8vU,She's My Baby,1508645,"She's got her pudding in the oven  And it's gonna be good  She better not leave me  And go out to Hollywood  She got the best pudding in the neighborhood  She's my baby  She can drive a truck  She can drive a train   She can even drive an aeroplane  She's so good to look at in the rain  She's my baby  She's comin' down the sidewalk  She's stumblin' through the door  She's coming home from places  She's never been before  She sits down on the sofa  She pours herself a drink  Says, ""Honey, honey, honey, ain't no time to think""  My baby  My baby  My baby  She's got a body for business  Got a head for sin  She knocks me over like a bowling pin  She came home last night and said  ""Honey, honey, honey, it's hard to get ahead""  My baby  My baby  She can build a boat  She can make it float   She can play my guitar  Note for note  She likes to stick her tongue right down my throat  She's my baby  My baby  My baby  My baby"
70mPF4cLf6RVpF2t0dPvpk,Inside Out,1400483,"Look out your window  That grass ain't green  It's kinda yellow  See what I mean?  Look up your chimney  The sky ain't blue  It's kinda yellow  You know it's true  It's so hard to figure what it's all about  When your outside's in   And your downside's up   Yeah, your upside's right   Yeah, don't it make you wanna twist and shout  When you're inside out?  Look down your drainpipe  What color do you see?  It's got to be yellow  Don't try to fool me  And don't it make you wanna twist and shout?  When your outside's in   And your downside's up   Yeah, your upside's right   Yeah, don't it make you wanna twist and shout  When you're inside out?  Be careful where you're walking  You might step in something rough  Be careful when you're talking  And saying all that stuff  Take care when you are breathing  Something's funny in the air  There's some things they're not saying  'Bout what's happening out there  It's inside out  Look into the future  With your mystic crystal ball  See if it ain't yellow  See if it's there at all  Ain't no shadow of doubt  Don't it make you wanna twist and shout?  When your outside's in   And your downside's up   Yeah, your upside's right   Yeah, don't it make you wanna twist and shout  When you're inside out?      Yeah, don't it make you wanna twist and shout  When you're inside out?  Inside out  Inside out"
