track_id,name,Lyric ID,Lyrics
4rUQACCcmDQLJGBvkYe68e,How Many More Days,403315,"There is something little darling  That I want you to know  Honey I love, yeah I need you  Every night, everyday goes so slow  How many more days?  Until I see you again  How many more days?  I want to see you again  Yes, I remember you smiling  I remember, you feeling mighty fine  I remember your kiss, I remember your touch  I can't get you out of my mind  Little girl, how many more days?  I want to see you again  How long will that take?  I want to see you again  Oh babe can't you see? I'll be honest with you  Please don't lie babe, please don't smile  Please don't play around with this heart of mine  Can't you see?  It's something I want babe  It's more than that, it's something I need  Oh little darling please be truthful, please  Be faithful, please come now to me  Oh baby, I need to see you again  Please remember, little lover  I'll give the good to you  Please remember, my little lover  I'll be good to you, but how many more days?  Until I can see you again?  How long will that take me  I need to see you again  Oh, how many more days?  I need to see you again  Please don't make me wait  I want to see you again"
1saTwLxAYTK3VmXDa9yKfe,Let Me Up (I've Had Enough),403317,"Work 20 years and they'll take care of you  They'll buy you a diamond, they'll send you on a cruise, yeah  Give it all your money, give it all your time  Then wake up one morning and wonder why  Let me up  I've had enough  Let me up  I've had enough  I believe you baby, I know you wouldn't lie  Like a dog won't bark, like a bird won't fly  Yeah, pretty little baby, you're a weapon with eyes  I know what you want, but it's a surprise    Yeah, yeah, be honest with me  Honey, am I what you thought I would be?  You tell me you love me baby, you'll be true  I know I believe you, but I don't know why I do  I woke up this morning, there was a car in the drive  I didn't recognize it, who was that guy?    Yeah, yeah, yeah, I tell you  This is not a question of humility here  I've had enough  Let me up  I've had enough  Let me up  I've had enough  Let me up  I've had enough  I've had enough"
1BbMhfUaNtdpwoHaCuPVhC,A One Story Town,403128,"I'm for standing up, I'm breaking free  I'm don't want fate handed down to me  Yeah I'm for moving on try another town  Oh, I'm lost in a one story town  Where everything's close to the ground  Yeah the same shit goes down  Nothing turns around  It's one story town  She was only seventeen  But I held her to her word  Had to push her luck  Thought she couldn't burn  No it didn't hurt me  When she had to leave  She had a far away feeling  Wasn't part of me  "
5eMZ3EPIMGoWlrrVhxatdv,You Got Lucky,403134,"You better watch what you say  You better watch what you do to me  Don't get carried away  Girl, if you can do better than me, go  Yeah go but remember  Good love is hard to find  You got lucky babe  Yeah, you got lucky babe  When I found you  You put a hand on my cheek  And then you turn your eyes away  If you don't feel complete  If I don't take you all of the way, go  "
2MAnZuuPH6bayqJO7EdQFs,Deliver Me,403135,"Every women and every man  Knows the feeling so well  Those times when the heart just can't understand  The times when you never can tell  So deliver me, deliver me  Baby take this heart, set it free  Take this chance, take this dream  Baby take this heart  Deliver me  I was born with something down inside of me  And it's carried me over, delivered me  Yeah delivered me, I'm standing at your gate  Just out of reach of the hands of fate    Sometimes I wonder if this is worth the trouble  Sometimes I wonder if this is worth the fight  I never have made my mind up about it  I've just decided to let it all ride"
0jVm8tMbpsDN7goNU6NyzL,Change Of Heart,403137,Well I fought for you  I fought too hard  To do it all again babe  It's gone too far  You never needed me  You only wanted me around  It gets me down  There's been a change  Yeah there's been a change of heart  Said there's been a change  You push just a little too far  You make it just a little to hard  There's been a change of heart  I'll get over you  It won't take long  I've stood in yer gallery  Seen what's hanging from the wall  You were the moon and sun  Yer just a loaded gun now  It gets me down    Looks like we finally found the turning point  Looks like it's time for me to kiss it goodbye  Kiss it goodbye  
4BjjeclMoQE7sIumDYRiq0,Finding Out,403149,"There's something wrong, I can't get my finger on it  I must be looking over something  Sometimes at night I've had to fight with this emptiness  It's been so hard to see, there's something more than this  I'm finding out, baby I'm finding out  Yeah it look a little time to get what love was about  But honey I'm coming around  I'm finding out  I've had enough of all this hard-core loneliness  I don't think pain is so romantic  I'm just a working man  I feel each day go by  I couldn't understand, I was too weak to fight    I have to thank you baby-honey I must confess  You have pulled me from this river of loneliness  "
2zRf7G1LNe1D6jXQw1zZfr,We Stand A Chance,403155,"Stand back from me honey  Because I don't know what I might do next  No I'm surprised by this, frightened by this  Nothing ever got me so out of my head, baby  We stand a chance  We stand a chance  Yeah, and I could be wrong, but you never know  We could stand the chance of a real love  Oh, God knows I love you  God knows I do  Baby will you let me just prove it to you  Come here to me baby, come here to me now  I want to talk to you, talk to you  And tell you somehow, that    I'm so moved, I'm so changed  My whole world is a fountain of flame  "
7qqxZi3lnnNNdoeUOwzN6g,Straight Into Darkness,403160,"There was a little girl, I used to know her  I still think about her, time to time  There was a moment when I really loved her  Then one day the feeling just died  We went straight into darkness  Out over the line  Yeah straight into darkness  Straight into night  I remember flying out to London  I remember the feeling at the time  Out the window of the 747  Man there was nothing, only black sky    Oh give it up to me I need it  Girl, I know a good thing when I see it  Baby wrong or right I mean it  I don't believe the thrill is all gone  Real love is a man's salvation  The week ones fall the strong carry on  "
7pfBopyS5sw5ScDAwgOfz4,The Same Old You,403164,"Hey, I remember you back in '72  With your David Bowie hair and your platform shoes  You had a part-time job, selling fast food  But out on the street you was nobody's fool  Baby way down deep it's the same old you  Way down deep you ain't hiding the truth  Just for a minute you had me confused  But baby way down deep it's the same old you  Well you can walk trough the city on fire  You can try and turn away from truth  Living life like a young politician  Sure of yourself and bullet-proof  But baby    We could buy a '62 Cadillac  Put a Fender amplifier in the back  Drive straight to the heart of America  Turn up to ten, let that sucker blast  "
7aSOQIbnPKwq3PE4oYKyjZ,Between Two Worlds,403179,"I got a dirty, dirty feeling  That I just can't shake  Yeah my brain keeps burying  And my body just aches  I know a women's body is only flesh and bone  How come I can't let go?  I'm between two worlds  I said I'm out of my mind  I'm between two worlds  There's lot of talk about the danger zone  There's adventure novels about taking to the road  "
2YjRaOhLqrmWCHmRgtGyc1,A Wasted Life,403182,I know you're walking down a lonely street  I know you can't get out of the heat  Baby it's alright  Don't have a wasted life  I know you have to feel a little used up  And no one can give you enough  Baby hold on tight  Don't have a wasted life  I love you too much  Don't have a wasted life  I love you to much  They give it to you from the time you're born  You keep trying to make one more score  Baby it's alright  You got to stand and fight  So when you're lonely and you feel let down  You can call me I'll come around  And treat you nice  
4kxO8k7tQwTuV62gU87MIz,Jefferson Jericho Blues,403615,Well poor Tom Jefferson  He loved the little maid out back  Midnight creeping out to the servant's shack  Kept a secret under the bed  Wrapped in a burlap sack  Well I drove all day and night  Out to Jericho  But in my second mind  I knew it was time to go  Yeah and I still get nervous every time  That bugle blows  Well she ain't no good for me  But I just can't let go  If I sit here thinking  My thoughts will overflow  And I can't keep from crying  Can't keep time from moving slow
09mpWWohdXZXaseBdeqgS8,First Flash Of Freedom,403622,On our first flash of freedom  I called out your name  Love it is hard  Like an overdue train  We felt so much more  Than our hearts could explain  On our first flash of freedom  A fistful of glory; a suitcase of sin  The language you dream in  When you count to ten  You go to the edge  And you always give in    Down every canyon and mountain we fall  We laugh at our shadows  Tall on the wall  Your brain is so full  But you can't keep it all    Across ancient bridges  Through a town with no name  Across painted hills  That no rich man came claim  Run the wild mustangs  That nothing can tame  
1bwXsRO9GBPeHYtQaCP9OI,Running Man's Bible,403623,You're with me tonight on this dark highway  We've run it together  So many times  We've run it for money  We've run it for music  We've run it to pay for our innocent crimes  I took on my father and I'm still walking  Took on all comers in some shape or form  And i see with the eyes of something wounded  Something still standing after the storm  Here's one to glory and survival  And staying alive  It's the running man's bible  I been next in line  I been next to nothing  Been next to bystanders  Who should have said something  It was not in my vision  It was not in my mind  To return from a mission  A man left behind  Here's one to glory  And survival  And staying alive  It's the running man's bible  I don't speak of the times I've nearly died  I don't speak of out lasting those who are gone  Or the things I've done  I care not to remember  Or the desperate measures  That might have been wrong  Honey here's one to glory  Here's to bad weather  And all the hard things  We've been through together  Here's to the golden rule and survival  And to staying alive  It's the running man's bible  Here's one to glory and survival  And staying alive  It's the running man's bible
39Y6FhE6CKDxHAJlU2jhUv,The Trip To Pirate's Cove,403625,"I took my few belongings  We headed out to Pirate's Cove  In my buddy's old Defender  We ran until the gas got low  We were flying close to heaven  Everything was starting to glow  Driving into sunset  Rolling 'cause we had to roll  I think he was a preacher  But lord I can't recall his name  He was running out of wind  But talking to me just the same  He said five I'll get you ten  But boy you've got to stay in the game  Yeah you got to let it ride  Or you've only got yourself to blame  We lost a wheel in Santa Cruz  So we partied with some motel maids  My friend said I don't like mine  So what do you say we trade  She was a part of my heart  Now she's just a line in my face  They let us go with a warning  Said we'd book you, but we don't have a case  My friend said take her with you  To leave her here would be a crime  But let's get outta Santa Cruz  All i got is a Canadian dime  I got a friend in Mendocino  And it's gettin' close to harvest time  And she was kinda cute  If a little past her prime  On the trip to Pirate's Cove   Driving into sunset  Driving into sunset"
5KPkd2iqW6r3Uoxnh3XcTV,Candy,403626,I sure like that candy  I don't go for them turnip greens  I sure like that candy  I don't go for them turnip greens  So when you put it on the table  Oh mama think about me  Well I don't drink Coca Cola  But I sure like the old moonshine  Well I don't drink Coca Cola  But I sure like the old moonshine  Yeah we drink it from a fruit jar  With my little baby by my side  Well I don't much like walking  But I love my Eldorado ride  I ain't never cared a thing about walking  But I love my Eldorado ride  Yeah we run it round the cornfield  With my little baby by my side  
0lG9clpLuNyQs9XfJd4EFF,No Reason To Cry,403628,All I'm wanting is to see you  And to hold you once again  And see the sun color your hair  And see the tall grass blow in the wind  Overcome me bitter sweetness  Put me under a magic spell  Overcome me all my sadness  Lead me on and wish me well  There's no reason to cry  There's no reason to cry  It's alright  So overtake me my sweet lover  Let me kiss your honey lips  Could be the only thing that's real  Could be when you get sad your memory slips  
0qyQKbbPLaG9FIENFTL7KY,I Should Have Known It,403629,I should have known it  I should have seen  Leave it to you  To treat me mean  Every promise was just a runaround  I should have known it  Yeah you're gonna let me down  Well it's over now you see  It's the last time you're gonna hurt me  I should have known it  Hard to believe  It was all right there  In front of me  Sold down the river  Left for dead  Yeah you're putting ideas  In another man's head    Thanks for nothing  Yeah thanks a lot  Go ahead baby  Take all I got  And it's over now ya' see  It's the last time you're gonna hurt me  It's the last time you're gonna hurt me
19w0XPUdIGym1k2GCaCYUJ,U.S. 41,404017,"My daddy came a marching  Over the hill at dawn  Had to make that wage man  That's how we got along  My daddy's life was working  Working all day long  Put food on the table  And the children sang a song  Yes, the children sang a song  My grandad's name was pulpwood  Wore a coat of green  Took a wife in '31  Drove the big machine  My daddy load the lumber  Put it on the truck  Used to see him walking home on U.S. 41  That's right, U.S. 41  All my life's been working  Out the door and gone  Got to make that overtime  Keep us moving on  Need a drink of water  To get out of the sun  Burning up to make that wage on U.S. 41  That's right, U.S. 41  The boss man owns the business  Keeps it going strong  Be blowing like a hurricane and  Work like nothing's wrong  We got to keep on moving  Until the bell gone ring  Fill her up with kerosene  And let that lady sing  Whoa now, let that lady sing  His given name was lucky  His wife's name Annie Brown  Run outside the law  And they chased him right on down  Lucky faced the lawman  The captain drew his gun  They put him with a sling blade  On U.S. 41  That's right, U.S. 41"
33BKOmrAYXpc2yycxD5h7S,Takin' My Time,404022,Taking my time  I'm slowing down a little bit  Taking my time  Slowing down a little bit  Yeah when I was a young boy  Honey my fuse was lit  Yeah when I was a young boy  Honey my fuse was lit  Losing my way  To something stronger than me  Losing my way  To something stronger than me  Scares me to think about  What's on the road after me  Yeah it scares me to think about  What's on the road after me
3eGvKdxK4cRs0CvkohrpP1,Let Yourself Go,404041,Rain on the river I'm soaking wet  Waiting on friend who ain't come yet  And he might not get here for three or four days  Got to make a little bit go a long way  I've got a blond headed woman who likes to come around  Cute little hippy girl lives in town  Brings a bag a records and she plays 'em 'til dawn  Give me little loving then she got to go home  When times are hard  When you start feeling low  Let yourself go  When the river's rising and the world feels cold  Let yourself go  Let yourself go  I got a 442 sitting in the sun  Well it's been ten years since she used to run  Man she was a beauty in '69  But there ain't no more coming down the line  
1dJTlLBUElqqU27D5EN207,Don't Pull Me Over,404042,"Don't pull me over mister policeman  Don't pull me over mister policeman  What I've got to do won't hurt anyone  Where I've got to go won't hurt anyone  Don't pull me over  I've got mouths to feed  Don't pull me over  They depend on me  What I've got to say won't hurt anyone  What I've got to do won't hurt anyone  When the moonlight turns to blue light  Makes me so afraid  So let me go  Leave me alone  Until I'm home and safe  Don't pull me over let me pass on by  Don't pull me over  Should be legalized  Don't pull me over mister policeman  Don't pull me over mister policeman  Please, please mister policeman  Please, please mister policeman"
5jQjF5cpLqomveKMUrFQ8K,Lover's Touch,404044,Oh my lord  She give me chills and fever  Sends a signal  To my receiver  Hard living killing me  I need that woman to set me free  And I want her  I want her so much  Cause she got the lover's touch  Feel sold out  Water getting higher  Living on the shoreline  Staring at the fire    I hear her voice  When I'm all alone  Gives me comfort  So soft and low  
4icPoSYZBZQ1kjRTSbYLDv,High In The Morning,404045,Boy that bottle belongs to the devil  Better leave it on the shelf  Could be the old man wants it for himself    Boy that woman belongs to the captain  Better let her go her way  Before the captain got something to say    Boy that power belongs to the devil  Better leave that power alone  Could be the devil gonna want it for his own  Well it hurts my heart to see a young man fall  Hurt me to my bones  To see him high in the morning and by evening  See him gone  To see him high in the morning and by evening  See him gone
53DoKGKHCae8SekXxqUqys,Something Good Coming,404147,I'm watching the water  Watching the coast  Suddenly I know  What I want the most  And I want to tell you  Still I hold back  I need some time  Get my life on track  I know that look on your face  But there's something lucky about this place  And there's something good coming  For you and me  Something good coming  There has to be  And I'm thinking about mama  And about the kids  And the way we lived  And the things we did  How she never had a chance  Never caught a break  And how we pay for our big mistakes  I know so well the look on your face  And there's something lucky about this place  There's something good coming  Just over the hill  Something good coming  I know it will  And I'm in for the long run  Wherever it goes  Riding the river  Wherever it goes  And I'm an honest man  Work's all I know  You take that away  Don't know where to go  And I know that look that's on your face  There's something lucky about this place  There's something good coming  For you and me  Something good coming  There has to be
3BFOW7dc6oxzuEPWKsESTI,Good Enough,404153,She was hell on her mama  Impossible to please  She wore out her daddy  Got the best of me  And there's something about her  That only I can see  And that's good enough  You're barefoot in the grass  And you're chewing sugarcane  You got a little buzz on  You're kissing in the rain  And if a day like this  Don't ever come again  Well that's good enough  Good enough for me  Good enough for right now  Good enough for right now  God bless this land  God bless this whiskey  I can't trust love  It's far too risky  If she marries into money  She's still going to miss me  And that's good enough  Going to have to be good enough
4gxB4rp8t4qw08KJR8aDkD,Shady Grove,1180903,"Shady Grove, my little love  Shady Grove, I say  Shady Grove, my little love  I'm bound to go away  Cheeks as red as blooming rose  And eyes are the prettiest brown  She's the darling of my heart  Sweetest lil' girl in town  I wish I had a big fine horse  And corn to feed him on  And Shady Grove to stay at home  And feed him while I'm gone  Went to see my Shady Grove  Standing in the door  Her shoes and stockin's in her hand  And her little bare feet on the door  When I was a little boy  I wanted a Barlow knife  Now I want little Shady Grove  To say she'll be my wife  "
7eq6lgiPU8Rx1c1OmuoB7N,Scare Easy,1530884,"My love's an ocean  You better not cross it  Yeah I've been the distance  And I need some rest  Yeah I had somebody once  And damn if I lost her  I've been running  Like a man possessed  I don't scare easy  Don't fall apart  When I'm under the gun  You can break my heart  And I ain't gonna run  I don't scare easy  For no one  Yeah, I am a loser  At the top of my game  I should have known  To keep an eye on you  Now I got a sky  That ain't never the same  Yeah, I got a dream  That don't ever come true  I don't scare easy  Don't fall apart  When I'm under the gun  You can break my heart  But I ain't gonna run  I don't scare easy  For no one  Sun going down  On a canyon wall  I got a soul  That ain't never been blessed  Yeah and I'm a shadow  At the back of the hall  Yeah, I got a sin  I ain't never confessed  And I don't scare easy  Don't fall apart  When I'm under the gun  You can break my heart  And I ain't gonna run  I don't scare easy  For no one  And I don't scare easy  Don't fall apart  When I'm under the gun  You can break my heart  But I ain't gonna run  I don't scare easy  For no one"
5j0FiP2FTLm9Bc4bxucgXk,Orphan Of The Storm,1772526,An orphan of the storm  She moved to Houston  To live below  That copper colored sky  Louisiana girl  Born into losing  The skyline of the city  Made her cry    So lord send me down  A fallen angel  With a miracle to perform  And I ain't the kind  Who gives up  But I'm so tired of rain  Lord I'm just an  Orphan of the storm  She'd lived there before  When she was using  Now she's standing on  The same old street again  Yeah that hurricane  It blew her back to Houston  Had to give into  The devil's howling wind    ---  Now somewhere down the line  There must be salvation  She thought it through  20 years ago  But sin spoke  A constant invitation  It was in her veins  And wouldn't let her go  
4q3iALbKeLqJCvFvhoO7Fa,Six Days On The Road,875991,"Well, I pulled out of Pittsburgh  I'm rollin' down the Eastern Seaboard  I've got my diesel wound up  She's running like she never did before  There's a speed zone ahead, all right  I don't see a cop in sight  Six days on the road and I'm gonna see my baby tonight  I've got ten forward gears  And a Georgiea overdrive  I'm taking little white pills  My eyes are open wide  Well I just passed a 'Jimmy' and a 'White  I've been passin' everything in sight  Six days on the road and I'm gonna see my baby tonight  Well it seems like a month  Since I kissed my baby good-bye  Could have a lot of women  But I'm not like some other guys  I could find one to hold me tight  But I could never believe it's right  Six days on the road and I'm gonna see my baby tonight  Well the I.C.C. is checking down the line  I'm a little overweight and my log's three days behind  But nothing bothers me tonight  I can dodge them scales all right  Six days on the road and I'm gonna see my baby tonight  Well my rig's a little old  That don't mean she's slow  And the smoke's rolling black as coal  Well my hometown's coming in sight  If you think I'm happy you're right  Six days on the road and I'm gonna see my baby tonight  Six days on the road and I'm gonna see my baby tonight  Six days on the road and I'm gonna see my baby tonight"
3m3u3pVVxJdGrNLxHIz7VK,Crystal River,1267766,Crystal river  Got a woman on the other side  Crystal river  Got a woman on the other side  And nothin' can touch me here  Nothin' can touch me here  Nothin' can touch me here  On crystal river  I love her  I swear by the diamond sky  I love her  I swear by the diamond sky  And nothin' can touch me here  And nothin' can touch me here  And nothin' can touch me here  On crystal river  I'm dreamin'  Dreamin' where  The water's wide  Crystal river  Got a woman on the other side  And nothin' can touch me here  Nothin' can touch me here  No nothin' can touch me here  On crystal river  ---  She's sleeping  Sleeping by the water side  She's sleeping  Out there on that bank  She lies  And nothin' can touch me here  Nothin' can touch me here  No nothin' can touch me here  On crystal river
0pMrZfvqwxWUd4Vz0L3vNg,Oh Maria,1384298,"Oh Maria  Hey Maria with your kind eyes  Laugh through the day time. Night comes, she cries  I am just a rider on this rough road  Driving some smoke up from old Mexico  Oh Maria, whiskey and rye. Walking up the stairs with a man twice her size  If I had money, I'd buy her a rose. Dress her in gold from her head to her toes  Yeah Maria sparkles like sunlight on a lake. Every time she passes by, it's all that I can take. Maria, oh oh oh. Maria, oh oh oh  Oh Maria stays out of the sun. Waits for the rain to fall down on her tongue. Hey Maria, give me a smile. Let me come over and stay for awhile  Yeah Maria sparkles like sunshine on a lake. Every time she passes by, it's all that I can take. Maria, oh oh oh. Maria, oh oh oh  Maria, oh oh oh. Maria, oh oh oh  Yeah Maria, send me a smile. Let me come over and stay for awhile"
58edgBxIttTsiyd2ibaXfG,This Is A Good Street,1618041,"This is a good street  We never walked it  You never held my hand as we crossed it  We never stopped along here to light a cigarette  This is a good street  This is a good house  It wasn't our home  It never scuffed you here on this threshold  I never waited for you by the window  This is a good house  This is a good room  You never slept here  You can't betray the faith that is kept here  And then no more tears will be wept here  This is a good room  This is a good bed, we never laid here  You can't erase the love that was made here  And a love that's love will not fade here  This is a good bed  This is a good heart and you can't take it  You can bend it, bruise it and shake it  But no my dear you can't break it  This is good heart  This is a good bed  This is a good room  This a good house  This is a good street  This is a good street  This is a good street"
